{
  "$schema": "http://json-schema.org/draft-07/schema#",
  "description": "Official Replicate API schema for runwayml/gen4-image-turbo",
  "properties": {
    "seed": {
      "type": "integer",
      "title": "Seed",
      "nullable": true,
      "description": "Random seed. Set for reproducible generation"
    },
    "prompt": {
      "type": "string",
      "title": "Prompt",
      "description": "Text prompt for image generation"
    },
    "resolution": {
      "allOf": [
        {
          "$ref": "#/components/schemas/resolution"
        }
      ],
      "default": "1080p",
      "x-order": 3,
      "description": "Image resolution"
    },
    "aspect_ratio": {
      "allOf": [
        {
          "$ref": "#/components/schemas/aspect_ratio"
        }
      ],
      "default": "16:9",
      "x-order": 2,
      "description": "Image aspect ratio"
    },
    "reference_tags": {
      "type": "array",
      "items": {
        "type": "string"
      },
      "title": "Reference Tags",
      "default": [],
      "description": "An optional tag for each of your reference images. Tags must be alphanumeric and start with a letter. You can reference them in your prompt using @tag_name. Tags must be between 3 and 15 characters."
    },
    "reference_images": {
      "type": "array",
      "items": {
        "type": "string",
        "format": "uri"
      },
      "title": "Reference Images",
      "default": [],
      "description": "You must give at least one reference image. Up to 3 reference images are supported. Images must be between 0.5 and 2 aspect ratio."
    }
  },
  "required": ["prompt"],
  "title": "gen4-image-turbo Input Schema",
  "type": "object"
}
