{
  "prompt": "Create a launch image for the new bottle. Reusable bottle. sun-drenched ceramics studio. Centered product portrait. soft window light. Clean editorial product photography. Visible text: NEW. Keep the bottle label readable",
  "reference_images": ["asset_product_123", "asset_product_124"],
  "resolution": "1080p",
  "seed": 42
}
